product_type,brand,product,rating,review_count,url,image_url,price,description
toner,Sensatia Botanicals,Sandalwood Dream Facial Toner,4.2,131,https://reviews.femaledaily.com/products/cleanser/toner/sensatia-botanicals/natural-face-toner,https://image.femaledaily.com/dyn/210/images/prod-pics/product_1589358017_sandalwood_800x800.jpg,Rp. 160.000,"Sensatia Botanicals Sandalwood Dream Facial Toner merupakan toner dalam bentuk spray yang memiliki fungsi untuk menyeimbangkan pH kulit dan memelihara kesehatan kulit. Dilengkapi dengan Kayu Cendana, Manggis, Mawar dan Palmarosa. Memiliki efek yang sejuk dan menenangkan bagi kulit.How to Use:Semprotkan pada area wajah dan leher secukupnya, kemudian tepuk-tepuk area tersebut dengan lembut agar produk dapat menyerap secara sempurna. Gunakan pada pagi dan malam hari.Suitable for:Kulit normal cenderung berminyakIngredients:Water (Aqua), Aloe Barbadensis (Aloe) Leaf Juice, Alcohol Denat., Sodium Citrate, Santalum Album (Sandalwood) Oil, Carica Papaya (Papaya) Fruit Extract, Pachyrrhizus Erosus (Jicama) Root Extract, Citric Acid, Rosa Damascena (Rose) Extract, *Geraniol, Cymbopogon Martini (Palmarosa) Oil, Garcinia Mangostana (Mangosteen) Fruit Extract, Centella Asiatica (Gotu Kola) Extract, *Citronellol, *Linalool, Potassium Sorbate, *Limonene, *Farnesol, *Eugenol, *Citral. *Occurs naturally in essential oils."
toner,Mineral Botanica,Acne Care Toner,3.3,129,https://reviews.femaledaily.com/products/cleanser/toner/mineral-botanica/acne-care-toner,https://image.femaledaily.com/dyn/210/images/prod-pics/1442554166_lg.jpg,Rp. 23.000,"Mineral Botanica Acne Care Toner adalah toner yang diformulasikan untuk mengangkat kelebihan kotoran atau makeup, sehingga muka lebih bersih dan segar sebelum menggunakan cream wajah.How to use :Aplikasikan pada wajah dengan kapasSuitable for :Semua jenis kulitIngredients :Aqua,Alcohol,Propylene Glycol,Hamamelis Virginiana Leaf ectract,PEG-40 Hydrogenated castor Oil,Camellia Sinensis leaf extract,Allantoin,DMDM Hydantoin,Fragrance,Triclosan,Menthol,Phenoxyethanol,Methylparaben,Ethylparaben."
toner,Anua,Heartleaf 77% Soothing Toner,4.6,129,https://reviews.femaledaily.com/products/cleanser/toner/anua/heartleaf-77-soothing-toner,https://image.femaledaily.com/dyn/210/images/prod-pics/product_1601370830_Heartleaf__800x800.png,Rp. 288.563,"Toner yang mengandung eksktrak Heartleaf yang tinggi, sehingga baik untuk merawat kulit bermasalah dan Lelah tanpa menyebabkan iritasi.- mengandung eksktrak Heartleaf 77%- manyeimbangkan kadai kelembaban & minyak - merawat Sel Kulit Mati tanpa iritasi Iritasi- bebas bahan berbahaya untuk kulit EWG Green GradeEfek Pemakaian :- Menenangkan kulit- Menyeimbangkan kadar kelembaban & minyak- Membersihkan sel kulit matiCara Pemakaian :Setelah mencuci wajah,Tuang produk secukupnya pada kapas atau langsung pada wajah, lalu usap keseluruh wajah,Tepuk-tepuk perlahan agar produk meresap.Anjuran Pemakaian :Bias digunakan pada area tubuh yang bermasalah selain wajah, bias digunakan sebagai masker(tuang kekapas) sebelum makeup di pagiIsi : 250ml*ingridientsHouttuynia Cordata Extract (77%), Air, 1,2-Hexanediol, Glycerin, Betaine, Panthenol, Saccharum Officinarum (Gula Tebu) Extract, Portulaca Oleracea Extract, Butylene Glycol, Vitex Agnus-Castus Extract, Chamomilla Recutita (Matricaria) Flower Extract, Arctium Lappa Root Extract, Phellinus Linteus Extract, Vitis Vinifera (Anggur) Fruit Extract, Pyrus Malus (Apel) Fruit Extract, Centella Asiatica Extract, Isopentyldiol, Methylpropanediol, Acrylates/C10-30 Alkyl Acrylate Crosspolymer, Tromethamine, Disodium EDTA"
toner,L'Oreal Paris,White Perfect Whitening & Moisturizing Toner,4,127,https://reviews.femaledaily.com/products/cleanser/toner/l-oreal-paris/white-perfect-22,https://image.femaledaily.com/dyn/210/images/prod-pics/1447233922-LOreal_Paris-White_Perfect.jpg,Rp. 105.300,"L'Oreal Paris White Perfect Whitening & Moisturizing Toner merupakan toner ringan dan segar yang mampu meresap secara langsung, menyeimbangkan kadar kelembapan kulit. Sehingga kulit terasa lebih halus, lembut, lebih kenyal, dan tampak bercahaya. How to Use:1. Gunakan pada kulit yang telah dibersihkan, sebelum rutinitas perawatan kulit Anda2. Aplikasikan produk secara merata pada wajah Suitable for:Dullness Concern & Dry Skin ToneIngredients:Aqua / Water, Glycerin, Butylene Glycol, Alcohol Denat., Hydroxyethylpiperazine Ethane Sulfonic Acid, Peg-60 Hydrogenated Castor Oil, Polystyrene, Calcium Pantetheine Sulfonate, Ascorbyl Glucoside, Lactic Acid, Disodium Edta, Methylparaben, Chlorphenesin, Parfum / Fragrance, Hydroxyisohexyl 3-Cyclohexene Carboxaldehyde, Butylphenyl Methylpropional Including / Dont (*) : Linalool, Limonene, Hexyl Cinnamal, Citronellol, Geraniol, Benzyl Alcohol, Benzyl Salicylate, Eugenol."
toner,ERHA Acneact,Clarifying Toner,3.2,127,https://reviews.femaledaily.com/products/cleanser/toner/erha-acneact/acne-clarifying-gel-2,https://image.femaledaily.com/dyn/210/images/prod-pics/product_1619079329_ERHA_ACNEA_800x800.jpg,Rp. 80.000,"Kombinasi Toner dan Oil Control untuk kulit berjerawat atau cenderung berjerawat.Merupakan rangkaian produk Acne Care Lab yang diformulasikan khusus untuk kulit berjerawat atau cenderung berjerawat. Clarifying Gel mengandung Asam Salisilat, Nicotinamide, AHA & Sebum Regulator untuk membantu mengurangi dan mengontrol produksi minyak berlebih serta membantu mengurangi kemerahan pada kulit.Setelah dibersihkan dengan Cleanser Scrub, aplikasikan Clarifying Gel pada kulit secara merata. Biarkan mengering. Jangan dibilas.Kemasan : Botol 60 ml"
toner,Skin1004,Madagascar Centella Tone Brightening Boosting Toner,4.2,127,https://reviews.femaledaily.com/products/cleanser/toner/skin1004/skin1004-madagascar-centella-tone-brightening-boosting-toner,https://image.femaledaily.com/dyn/210/images/prod-pics/product_1633065464_Skin1004_M_800x800.png,Rp. 280.000,Brightening Boosting Toner
toner,Envygreen,Intense Hydrating Toner Essence,4,126,https://reviews.femaledaily.com/products/cleanser/toner/envygreen/hydrating-toner-essence,https://image.femaledaily.com/dyn/210/images/prod-pics/product_1606729163_Screenshot_800x800.jpg,Rp. 155.000,"Envygreen Intense Hydrating Toner Essence merupakan Face Treatment Essence yang menyerap dengan cepat ke dalam kulit sehingga membantu merawat kulit agar tetap ternutrisi dan halus. Kandungan antioksidan yang tinggi cocok digunakan kulit kering, normal dan normal cenderung kering. Produk ini juga dapat digunakan sebagai home treatment.How to use:Pastikan wajah dalam keadaan bersih. Teteskan toner secukupnya ke tangan. Aplikasikan merata ke seluruh wajahSuitable for:Semua jenis kulitIngredients: Aqua, aloe barbadensis extract, pentylene glycol, phenoxythanol, sodium ascorbyl phosphate, panax ginseng extract, sodium hyaluronate, ethylhexyglycerin."
toner,Cezanne,Skin Conditioner High Moist,4.4,125,https://reviews.femaledaily.com/products/cleanser/toner/cezanne/skin-conditioner-49,https://image.femaledaily.com/dyn/210/images/prod-pics/8a819305f1c06b498a5d56188bd468ea.jpg,Rp. 199.000,There's no description for this product.
toner,Innisfree,Green Tea Balancing Skin Ex,3.8,125,https://reviews.femaledaily.com/products/cleanser/toner/innisfree/green-tea-balancing-skin-1,https://image.femaledaily.com/dyn/250/images/prod-pics/product_1668140694_acne_smoot_800x800.jpg,,
toner,Skintific,Glycolic Acid Daily Clarifying Toner,4,125,https://reviews.femaledaily.com/products/cleanser/toner/skintific/glycolic-acid-daily-clarifying-toner,https://image.femaledaily.com/dyn/210/images/prod-pics/a7257dbf986d2bd85acd0c2e87dba2b1.jpg,,"Skintific Glycolic Acid Daily Clarifying TonerToner eksfoliasi ringan yang diformulasikan aman untuk digunakan setiap hari. Mengandung Glycolic Acid kualitas terbaik untuk membantu mencerahkan kulit. Kandungan Glycolic Acid membantu melawan jerawat dan beruntusan yang muncul pada kulit wajah. Didukung dengan kandungan Niacinamide dan Lactobionic Acid untuk mendorong efektifitas untuk mengurangi tampilan pori-pori, menjadikan kulit bercahaya dan halus. Dilengkapi dengan kandungan 5X Ceramides untuk menjaga dan memperbaiki skin barrier.Ukuran: 80 mlNo BPM: NA11221200548Manfaat:•Melawan jerawat dan beruntusan•Mengangkat sel kulit mati dengan lembut•Mengurangi tampilan pori-pori•Menjaga dan memperbaiki skin barrier•Menjadikan kulit lebih halus & tampak lebih cerahHero Ingredients:Glycolic Acid : Asam alami yang merevitalisasi kulit dengan mengangkat sel kulit mati secara ringan, meregenerasi kulit, serta meningkatkan produksi kolagenNiacinamide : Memperbaiki warna kulit yang tidak merataNiacinamide : Memperbaiki warna kulit yang tidak merata dan mengurangi tampilan pori-poriLactobionic Acid (PHA) : Eksfoliator alami untuk merawat kulit kusam dan berjerawat.Cara pemakaian:Gunakan secukupnya menggunakan kapas halus, gosokkan pada area wajah secara merata dan lembut. Dapat digunakan setiap hari, pada malam hari.SAFE FOR ALL SKIN TYPES:No SLSNo AlcoholNo ParabenNo Mineral OilNo Artificial ColorantVegan FriendlyCruelty FreeIngredients:Aqua, Butylene Glycol, Galactomyces Ferment Filtrate,Niacinamide, Glycolic Acid, 1,2-Hexanediol, Lactobionic Acid, Hyaluronic Acid, Hydroxyethylpiperazine Ethane Sulfonic Acid, Centella Asiatica Extract, Gentiana Scabra Root Extract, Caprylyl Glycol, Ceramide NP, Ceramide NS, Ceramide AS, Ceramide EOP, Ceramide AP, Glycerin, O- Cymen-5-OI, Polyacrylate Crosspolymer-6, Ethylhexylglycerin, Lactic Acid, Hydroxyacetophenone, Sodium Citrate, Citric Acid, Carbomer, Nordihydroguaiaretic Acid, Oleanolic Acid, Biotin."
toner,Hada Labo,Shirojyun Premium Whitening Lotion,4.3,125,https://reviews.femaledaily.com/products/cleanser/toner/hada-labo/shirojyun-premium-whitening-lotion,https://image.femaledaily.com/dyn/210/images/prod-pics/775fe8499851cf8ee84c01b5e053fdc1.jpg,Rp. 220,
toner,Emina,Double The Moist Face Toner,3.4,123,https://reviews.femaledaily.com/products/cleanser/toner/emina/emina-face-toner,https://image.femaledaily.com/dyn/250/images/prod-pics/product_1668140694_acne_smoot_800x800.jpg,,
toner,LABORE,AcnePro Biome Micro Exfoliating Gentle Toner,4.2,123,https://reviews.femaledaily.com/products/cleanser/toner/labore/acnepro-biome-micro-exfoliating-gentle-toner,https://s3.ap-southeast-1.amazonaws.com/assets.femaledaily.com/remastering-data/production/product/product-1717124827466-,Rp. 179.000,"LABORÉ Sensitive Skin Care Micro Exfoliating Gentle Toner merupakan toner eksfoliasi yang diformulasikan untuk kulit acne prone dan sensitif dengan Targeted Salicylic Acid dan Micro Mist Technology menghasilkan molekul mikro yang secara spesifik menargetkan komedo dan bakteri C. acnes dan acne biofilm dan membersihkan pori-pori yang tersumbat. Kemasan spray memudahkan aplikasi produk pada wajah, dada, dan punggung yang berjerawat. How to use:1. Pastikan wajah dalam keadaan bersih2. Semprotkan 3-4 pump exfoliating toner pada wajah secukupnya. Hindari kontak langsung dengan mata3. Tap-tap pada wajah dengan lembut, pastikan exfoliating toner merata4. Wajah siap untuk penggunaan rangkaian skincare selanjutnyaSuitable for:Kulit berjerawatIngredients:Aqua, Niacinamide, PEG-8, Glycerin, Propanediol, Salicylic Acid, 1,2-Hexanediol, Aminomethyl Propanol, Allantoin, Chlorphenesin, Disodium EDTA, Caprylhydroxamic Acid, Isostearamidopropyl Ethyldimonium Ethosulfate, Sodium Hydroxide, Sodium Citrate, Phragmites Kharka Extract, Poria Cocos Extract, Citric Acid, Sodium Benzoate, Propylene Glycol, Maltodextrin, Carthamus Tinctorius Seed Oil, Olea Europaea Fruit Oil, Lactobacillus Ferment."
toner,Corine de Farme,Gentle Rose Water,3.9,122,https://reviews.femaledaily.com/products/cleanser/toner/corine-de-farme/gentle-rose-water,https://image.femaledaily.com/dyn/210/images/prod-pics/731c33fc879d6449782b89b029982cce.jpg,Rp. 115.000,"CORINE DE FARMEGentle Rose WaterRp. 115,000 Gentle Rose WaterQuantity: ADD TO WISHLISTADD TO BAGDetailsDengan lembut mengangkat kotoran dan sisa pembersih di wajah, Menyegarkan dan melembutkan kulit, Menenangkan dan melembabkan kulit.Keunggulan:No Fragrance: keharuman alami yg di dapat dari ekstrak rose damascusParaben freePhenoxyethanol freeAlcohol freeNo Colouring agentsHypoalergenicKomposisi:Ekstrak rose of Damascus: menyegarkan dan melembutkan kulitSodium PCA: Pelembab alamiBisabolol alami : Menenangkan kulit"
toner,Wardah,Hydra Rose Petal Infused Toner,3.8,121,https://reviews.femaledaily.com/products/cleanser/toner/wardah/hydra-rose-petal-infused-toner,https://image.femaledaily.com/dyn/210/images/prod-pics/product_1610536804_Hydra_Rose_800x800.jpg,Rp. 102.000,"Wardah Hydra Rose Petal Infused Toner 100ml yaitu toner dengan 72 Hours Hydrating Active menghidrasi dan mengembalikan kelembapan kulit agar siap menyerap nutrisi dari produk skin care yang digunakan selanjutnya. Pure Rose Water dengan Real Rose Petal didalamnya bantu menenangkan serta mengembalikan kelembapan optimal kulit wajah.How To Use :Tepukkan toner secara merata pada wajah, sebelum menggunakan serum.Ingredient :72 hours hydration active, Pure rose water, Real Rose Petal----------------------------------------------------------------------------------------------------------------------------------------------------------------Wardah Hydra Rose Dewy Aqua Day Gel, pelembab dengan tekstur gel ringan dan watery mengandung 72 Hours Hydrating Active dan Rose Oil yang menghidrasi serta menjaga kelembapan kulit. Diperkaya dengan Bio-Hyaluronic Acd yang melapisi permukaan kulit, bekerja ekstra menjaganya tetap terhidrasi sepanjang hari. How To Use :Oleskan merata pada wajah dan leher yang telah dibersihkan, setelah menggunakan serum.Ingredient :72 Hour Hydrating Active, Rose Oil, Bio-Hyaluronic"
toner,Bioderma,Sensibio Tonique - Soothing Toner,4.2,120,https://reviews.femaledaily.com/products/cleanser/toner/bioderma/sensibio-tonique-soothing-toner,https://s3.ap-southeast-1.amazonaws.com/assets.femaledaily.com/remastering-data/production/product/product-1709707510955-,Rp. 315.000,"Bioderma Sensibio Tonique - Soothing Toner merupakan toner yang menenangkan kulit serta memaksimalkan pembersihan wajah sekaligus menghidrasi.  Tersedia dalam ukuran: 100ml: 170,000250ml: 315,000How to use:Oleskan pada wajah dan leher yang bersih. teteskan sedikit pada telapak tangan atau pada kapas bersih lalu pijat-pijat ringan.Suitable for:Kulit normal dan kulit kering yang sensitif.Ingredients:-"
toner,Sariayu,Refreshing Aromatic Toner,3.4,120,https://reviews.femaledaily.com/products/cleanser/toner/sariayu/sariayu,https://image.femaledaily.com/dyn/210/images/prod-pics/1442468787_lg.jpg,Rp. 9.500,"Sariayu Refreshing Aromatic Toner merupakan penyegar wajah dengan kandungan minyak peppermint sebagai refreshing aromatic. Produk ini diperkaya ekstrak jeruk nipis untuk membantu mengurangi kelebihan minyak dan kesan mengkilat pada wajah dan untuk mengecilkan pori-pori serta Vitamin E sebagai anti oksidan.How to UseAplikasikan ke seluruh permukaan wajah dengan menggunakan kapas.Suitable forKulit normal, kulit berminyak.Ingredientswater, alcohol, propylene glycol, sorbitol, polysorbate 20, citrus aurantifolia fruit extract, tocopherol acetate, mentha piperita oil, methylparaben, sodium hydroxide, CI 19140, sodium chloride, sodium sulfate, CI 16255, fragrance."
toner,Jumiso,Waterfull Hyaluronic Acid Toner,4.7,118,https://reviews.femaledaily.com/products/cleanser/toner/jumiso/waterfull-hyaluronic-acid-toner,https://image.femaledaily.com/dyn/250/images/prod-pics/product_1668140694_acne_smoot_800x800.jpg,,
toner,Kojie San,Cleanser Toner Dual Action,3.7,118,https://reviews.femaledaily.com/products/cleanser/toner/kojie-san/cleanser-toner-dual-action-1,https://image.femaledaily.com/dyn/210/images/prod-pics/product_1638861770_371816b965_800x800.jpg,Rp. 50.000,"Kojie San Cleanser Toner Dual Action adalah kombinasi dari pembersih wajah dan toner yang akan membuat kulit wajah terasa segar dengan cara menghilangkan minyak dan mencegah komedo. Bahan aktifnya akan membersihkan kulit, mengecilkan pori-pori, juga mengeksfoliasi sel kulit mati.How to use :Aplikasikan pada wajah dengan kapasSuitable for :Semua jenis kulitIngredients :Deionized water, Ethyl Alcohol, Sodium Lactate, Glycerin, PEG-7 Glyceryl Cocoate, Panax Ginseng Extract, PEG-40 Hydrogenated Castor Oil, Rosa Canina (Rose Hip) Extract, Fragrance, Allantoin, Octyl Methoxycinnamate, Menthol, EDTA, Lactic Acid, Methylchloroisothiazolinone, Methylisothiazolinone"
toner,Emina,Skin Buddy Face Toner,3.9,118,https://reviews.femaledaily.com/products/cleanser/toner/emina/emina-skin-buddy-face-toner,https://image.femaledaily.com/dyn/210/images/prod-pics/08ada7c0c45a16b726fac734e6ab874f.jpg,Rp. 0,There's no description for this product.
toner,Himalaya,Purifying Neem Cleansing Astringent,3.3,117,https://reviews.femaledaily.com/products/cleanser/toner/himalaya/purifying-neem-cleansing-astringent,https://image.femaledaily.com/dyn/210/images/prod-pics/product_1441354262_purifying__800x800.jpg,Rp. 13.000,"Himalaya Purifying Neem Cleansing Astringent diformulasikan khusus untuk membersihkan pori-pori secara mendalam dan mengontrol kelebihan minyak di wajah. Produk ini mengandung Neem yang dikenal sebagai antibakteri untuk mengontrol jerawat dan komedo, Lemon dan Lodh untuk mengencangkan pori-pori dan mengencangkan kulit. Produk ini memberikan hasil kulit menjadi segar, bersih, dan terbebas dari masalah kulit.How To Use:Tuangkan pada kapas, lalu tepuk tepuk kapas pada wajah yang telah dibersihkanSuitable For:Kulit berminyakKey Ingredients:Neem, Lemon"
toner,Trueve,Recharge Hydrating Essence Toner,3.9,117,https://reviews.femaledaily.com/products/cleanser/toner/trueve/recharge-hydrating-essence-toner,https://image.femaledaily.com/dyn/210/images/prod-pics/product_1644217546_Recharge_H_800x800.jpg,Rp. 177.000,"Trueve Recharge Hydrating Essence Toner diformulasikan untuk mencerahkan wajah dan memperbaiki tekstur kulit menjadi lebih halus. Dengan kandungan utama Galactomyces 10%, Trueve Recharge Hydrating Essence Toner cocok untuk semua jenis kulit dan aman bagi ibu hamil maupun menyusui.How to use:Teteskan 5 tetes toner ke kapas/tangan, kemudian usapkan dan pijat perlahan hingga meresap dan merata pada kulit wajah, kemudian diamkan beberapa saat agar serum meresap ke kulit.Suitable for:Semua jenis kulitIngredients:Galactomyces 10%, Hyaluronate, Ceramide"
toner,Natur Beauty,Renew Skin Hydrating Toner,4.1,116,https://reviews.femaledaily.com/products/cleanser/toner/natur-beauty/renew-skin-hydrating-toner,https://image.femaledaily.com/dyn/210/images/prod-pics/product_1617181700_Renew_1__800x800.jpg,Rp. 139.000,"Natur Renew Skin Hydrating Toner merupakan toner yang efektif untuk memperbaiki tekstur kulit, menguatkan skin barrier, meningkatkan produksi kolagen, mencegah tanda-tanda penuaan dini, mengurangi blackhead, menhidrasi dan mengunci kelembabkan lapisan kulit, membantu menyembuhkan kerusakan kulit, mengurangi jerawat meradang, blind acne dan jerawat hormonal, serta mengurangi kerutan, age spot, dan garis halus.How to use:Tuang produk pada kapas atau telapak tangan. Usapkan pada wajah yang telah dibersihkanSuitable for:Semua jenis kulitIngredients:Ginseng, Galactomyces, Niacinamide, Natural Hyaluronic, Allantoin"
toner,NIVEA,Refreshing Toner,3.8,115,https://reviews.femaledaily.com/products/cleanser/toner/nivea/refreshing-toner,https://image.femaledaily.com/dyn/210/images/prod-pics/product_1620284812_NIVEA_800x800.jpg,Rp. 19.500,"NIVEA Refreshing Toner adalah adalah penyegar untuk menjernihkan kulit normal ke kombinasi dengan cara yang efektif namun halus. Diperkaya dengan Vitamin dan Ekstrak Lotus, menjadikan kulit bergizi secara optimal, menjaga keseimbangan kelembaban alaminya seraya mengangkat kotoran sehari-hari dari kulit. Formulanya menyegarkan serta memperkuat kulit. Telah teruji secara dermatologis dan optalmologis. How To Use:Gunakan tiap pagi dan malam sebagai bagian dari rutinitas pembersihan wajah. Oleskan dengan lembut sambil memijat ke kulit dengan ujung jari atau kapas. Hapus dengan menggunakan kapas. Untuk hasil yang maksimal, gunakan rangkaian NIVEA Visage komplit untuk kulit normal ke kombinasi. Suitable For:Kulit normal, kulit kombinasiIngredients:Ekstrak Lotus & Vitamin, Aqua, Stearic Acid, Lauric Acid, Myristic Acid, Potassium Hydroxide, Glycerin, Acrylates Copolymer, PEG-7 Glyceryl Cocoate, Potassium Chloride, Cetearyl Alcohol, Cocamide MIPA, Glycol Distearate, Glyceryl Stearate, Trisodium EDTA, Hydroxyethylcellulose, BHT, Tocopheryl Acetate, Propylene Glycol, Panthenol, Nelumbium Speciosum Flower Extract, Parfum"
toner,Crystallure,Dual Refining Treatment Solution,4.6,115,https://reviews.femaledaily.com/products/cleanser/toner/crystallure/dual-refining-treatment-solution-2,https://image.femaledaily.com/dyn/210/images/prod-pics/product_1678857414_packshot_c_800x800.jpg,Rp. 285.000,"Crystallure Dual Refining Treatment Solution merupakan toner dual-phase unik yang mengeksfoliasi kulit dengan lembut dan memberikan hidrasi yang intens, telah teruji secara dermatologis memberikan kulit yang tampak lebih halus, cerah, dan tanda-tanda penuaan tersamarkan. Fresh-watery layer nya terdiri dari bahan aktif PHA yang berfungsi sebagai exfoliator lembut tanpa menyebabkan iritasi di wajah untuk mangangkat sel kulit mati, sedangkan oil layer terdiri dari Meadowfoam Lipidic Essence yang tinggi akan sifat menghidrasi dan mampu mengunci hidrasi di dalam kulit. Dengan penambahan 3% Encapsulated Ferulic Acid yang kaya akan antioksidan dan Gold Peptide Crystals, membantu memudarkan tampilan garis halus, kulit lebih kencang, dan kenyal. How to use:1. Bersihkan wajah menggunakan cleansing foam/face wash2. Kocok produk hingga 2 layer (oil dan fresh watery essence) tercampur merata3. Tuangkan beberapa tetes produk ke telapak tangan atau kapas, lalu usapkan ke wajah. Tepuk-tepuk pelan hingga meresap sempurna, tidak perlu digosok4. Dapat digunakan di pagi dan malam hari. Suitable for:Semua jenis kulitIngredients:-"
toner,OASEA,Squalane Barrier Hydra Toner,4.4,114,https://reviews.femaledaily.com/products/cleanser/toner/oasea/squalane-barrier-hydra-toner-1,https://image.femaledaily.com/dyn/210/images/prod-pics/26c176bd9705916d44d958bca9b61eaf.jpg,Rp. 199.000,"Squalane Barrier Hydra Toner merupakan toner wajah sehari-hari yang berfungsi untuk menghidrasi kulit wajah dan merawat skin barrier. Toner ini diformulasikan dengan menggunakan hero ingredients yaitu Squalane, Niacinamide, dan Multibiotics. Multibiotics ini terdiri dari Dermabiotik sebagai Probiotik, Inulin sebagai Prebiotik dan C-Pep Elastyl sebagai Postbiotik. Kombinasi hero ingredients dan bahan aktif lainnya membuat toner ini berfungsi untuk mengurangi dark spots, menjaga elastisitas kulit, mengurangi minyak berlebih dan mengurangi tanda-tanda penuaan dini. Sehingga step penggunaan Squalane Barrier Hydra Toner ini penting karena berperan sebagai fondasi agar kulit wajah siap untuk menerima skincare lainnya dan manfaatnya lebih maksimalKombinasi Squalane Barrier Hydra Toner dan Oceanus Squalane + Tranexamic Spot Correcting Face Oil Serum efektif sebagai brightening booster untuk kulit wajah. Sehingga dapat membantu mencerahkan wajah secara optimal. Sedangkan, kombinasi Squalane Barrier Hydra Toner dan Oceanus Squalane + Salicylic Acne Control Face Oil Serum dapat mengurangi sensitivitas terhadap kulit akibat bahan yang berfungsi sebagai eksfoliator. Sehingga, dapat mengurangi rasa cekit-cekit yang ditimbulkan Acne Control Face Oil Serum untuk kulit sensitif."
toner,Glowinc Potion,GENTLE+ Soothing Essence Toner,3.8,114,https://reviews.femaledaily.com/products/cleanser/toner/glowinc-potion/gentle-soothing-essence-toner,https://image.femaledaily.com/dyn/210/images/prod-pics/product_1629783080_32_Gentle__800x800.jpg,Rp. 89.000,"Glowinc Potion GENTLE+ Soothing Essence Toner merupakan toner wajah yang lembut untuk tahapan perawatan kulit sehari-hari. Membantu menenangkan kulit, menjaga barrier kulit, & membantu mengurangi kemerahan kulit. Diformulasikan dengan Propolis, Triple Ceramide, Turmeric & Aloe Water.How to use:Gunakan toner langsung ke tangan atau kapas. Oleskan ke seluruh wajahSuitable for:Kulit sensitifIngredients:Aloe Barbadensis Leaf Water, Propylene Glycol, Glycerin, Polyglyceryl-4 Caprate, Phenoxyethanol, Curcuma Longa (Rhyzome) Extract, Tocopheryl Acetate, Chamomilla Recutita Flower Extract, 1,2-Hexanediol, Butylene Glycol, Ethylhexylglycerin, Sodium Lauroyl Lactylate, Pentylene Glycol, Methyl Diisopropyl Propionamide, Ceramide NP, Ceramide AP, Phytosphingosine, Cholesterol, Xanthan Gum, Carbomer, Propolis Extract, Ceramide EOP"
toner,Bloomka,Calendula + Vitamin B3 Whitening Facial Toner,3.9,114,https://reviews.femaledaily.com/products/cleanser/toner/bloomka/calendulavitamin-b3-whitening-facial-toner,https://image.femaledaily.com/dyn/210/images/prod-pics/product_1638427043_0000008284_800x800.jpg,Rp. 88.000,"Bloomka Calendula + Vitamin B3 Whitening Facial Toner merupakan toner bebas alkohol dengan petal bunga calendula asli yang mengandung calendula flower extract dan vitamin b3 yang berfungsi untuk menyegarkan sekaligus mencerahkan kulit wajah.How to use:Tuangkan secukupnya pada telapak tangan atau kapas, aplikasikan ke seluruh wajah dan leher setelah membersihkan wajah.Suitable for:Kulit kering, Kulit sensitifIngredients:-"
toner,Safi,Age Defy Skin Refiner,3.7,113,https://reviews.femaledaily.com/products/cleanser/toner/safi/age-defy-skin-refiner,https://image.femaledaily.com/dyn/210/images/prod-pics/product_1597144280_age_skin_r_800x800.jpg,Rp. 45.000,There's no description for this product.
