product_type,brand,product,rating,review_count,url,image_url,price,description
sun protection,Emina,Sun Protection SPF 30 PA+++,3.7,15719,https://reviews.femaledaily.com/products/moisturizer/sun-protection-1/emina/sun-protection-spf-30-pa,https://image.femaledaily.com/dyn/210/images/prod-pics/product_1469761401_Sun_Protec_800x800.jpg,Rp. 26.000,Emina Sun Protection dengan SPF 30 dan PA+++ memiliki tekstur ringan yang membantu melindungi kulitmu dari sinar UV di hari yang aktif. Diperkaya dengan Aloe Vera Extract dan Emollient untuk memberikan kelembaban ekstrak pada kulit.How to Use:Oleskan pada kulit di pagi hari sebelum keluar rumahSuitable for:Semua jenis kulitIngredients:-
sun protection,Azarine Cosmetic,Hydrasoothe Sunscreen Gel SPF 45+++,4.8,14814,https://reviews.femaledaily.com/products/moisturizer/sun-protection-1/azarine-cosmetic/hydrashoothe-sunscreen-gel-spf45-3,https://image.femaledaily.com/dyn/210/images/prod-pics/product_1677224393_Hydrasooth_800x800.jpg,,"DAILY SKIN PROTECTION FOR SUNSCREEN HATERSORGANIC SUNSCREEN GEL SPF45+++ FOR ALL SKIN TYPESTabir surya wajah dalam bentuk gel ( water base) yang sangat ringan, dingin dan mudah meresap untuk seluruh jenis kulit termasuk kulit berminyak dan acne prone skin. Di formulasikan dengan kandungan bahan alami Propolis, aloe Vera, green tea dan delima untuk melindungi kulit dari sinar UV A & UV B serta menutrisi kulit. KEUNGGULAN:- 0% alcohol ( bisa untuk kulit sensitif)- 0 % Oil ( bisa untuk kulit berminyak, kombinasi dan berjerawat)- 0% Silicone - Fungal acne Friendly- No Whitecast / efek dempul- Cepat meresap, ringan dan dingin dengan SPF tinggi- Mengandung ekstrak alami untuk kulit- Antioksidan & MelembabkanKEY INGREDIENTS:1.Aloe Vera: Menyegarkan & Menenangkan kulit2. Greentea: Antioksidan tinggi untuk menangkal radikal bebas & anti aging/ firming3. Propolis: Menutrisi & antiseptik alami4. Pomegranade: Antioksidan & moisturizer"
sun protection,Skin Aqua,UV Moisture Milk,4.3,10475,https://reviews.femaledaily.com/products/moisturizer/sun-protection-1/skin-aqua/uv-moisture-milk,https://image.femaledaily.com/dyn/210/images/prod-pics/product_1564649232_Skin_Aqua__800x800.jpg,Rp. 48.500,"Skin Aqua UV Moisture Milk merupakan pelembab yang mengandung SPF 50+. PA +++ untuk perlindungan ganda terhadap UV-A & UV-B. Produk ini juga mengandung Hydraulic Acid (AcHA) dan Collagen yang melembabkan, melembutkan kulit, dan mempertahankan elastisitas kulit, mengandung VItamin B5 dan E juga yang dapat menutrisi kulit.How To Use:Aplikasikan pada bagian wajahSuitable For:Semua jenis kulitIngredients:Water, Cyclopentasiloxane, Zinc Oxide, Silica, Lauryl PEG-9 Polydimethylsiloxyethyl Dimethicone, Methicone, Triethoxysilylethyl polydimethylsiloxyethyl hexyl dimethicone, Ethylhexyl methoxycinnamate, Polymethylsilsesquioxane, Butylene Glycol, Triethylhexanoin, Trimethylsiloxysilicate, Lauroyl lysine, Diethylamino Hydroxybenzoyl Hexyl Benzoate, Methylparaben, Disodium EDTA, Propylparaben, Tocopheryl Acetate, Dipotassium Glycyrrhizate, Magnesium Ascorbyl Phosphate, Hydrolyzed collagen, Sodium Hyaluronate, Panthenol"
sun protection,Biore,UV Aqua Rich Watery Essence SPF 50+ PA++++,4.2,7883,https://reviews.femaledaily.com/products/moisturizer/sun-protection-1/biore/uv-aqua-rich-watery-essence-1,https://image.femaledaily.com/dyn/210/images/prod-pics/product_1684728705_25437884_B_800x800.jpg,Rp. 140.000,"Biore UV Aqua Rich Watery Essence SPF 50+/PA++++ adalah pelindung wajah dan badan dari efek buruk sinar UVA dan UVB. Dilengkapi kandungan Aqua Micro Capsule yang memberikan sensasi sejuk di kulit, “mengunci” UV dan bertekstur ringan seperti air, sehingga mampu menjaga kelembaban kulit lebih lama. Terdapat juga kandungan Hyaluronic Acid & Citrus Essence untuk menjaga kulit tetap lembab dan segar tanpa rasa lengket karena mudah menyerap ke dalam kulit.How To Use:Aplikasikan pada seluruh wajah dan tubuh dalam keadaan bersih, gunakan setiap ingin melakukan aktivitas diluar ruangan pada pagi/siang hariSuitable For:Semua jenis kulitIngredients:-"
sun protection,NPURE,Cica Beat The Sun,4.8,3694,https://reviews.femaledaily.com/products/moisturizer/sun-protection-1/npure/cica-beat-the-sun,https://s3.ap-southeast-1.amazonaws.com/assets.femaledaily.com/remastering-data/production/product/product-1705996114249-NPURE-Cica-Beat-The-Sun,,
sun protection,Skin Aqua,UV Moisture Gel,4.1,3592,https://reviews.femaledaily.com/products/moisturizer/sun-protection-1/skin-aqua/uv-moisture-gel-69,https://image.femaledaily.com/dyn/210/images/prod-pics/product_1571371623_Untitled_d_800x800.jpg,Rp. 47.700,"Skin Aqua UV Moisture Gel SPF 30 dan PA++ dapat memberikan perlindungan dari sinar UVA dan UVB. Mengandung Improved Hyaluronic Acid, Collagen, vitamin B, E dan C dapat melembabkan, melembutkan, mempertahankan elastisitas kulit, dan menutrisi kulit.How To Use:Usapkan di wajah yang telah dibersihkan. Biarkan hingga meresap dan gunakan makeup seperti biasa.Suitable For:Kulit Normal dan Berminyak.Ingredients:Water, PEG 400, Ethylhexyl methoxycinnamate, Octocrylene, Arbutin, Butyl Methoxydibenzoylmethane, Silica, Cyclopentasiloxane, Bisethylhexyloxyphenol methoxyphenyl triazine, Phenoxyethanol, PEG-20 Methyl Glucose Sesquistearate, Acrylates/C10-30 alkyl acrylate crosspolymer, Arginine, Disodium EDTA, Dipotassium Glycyrrhizate, Polyquaternium-51, Daucus carota Sativa, Sodium Hyaluronate, Acrylates/Acrylamide Copolymer/Mineral Oil/Polysorbate 85."
sun protection,L'Oreal Paris,UV Perfect Matte & Fresh Long UV SPF 50/ PA++++,3.7,3455,https://reviews.femaledaily.com/products/moisturizer/sun-protection-1/l-oreal-paris/uv-perfect-matte-and-fresh-long-uv-spf-50-pa,https://image.femaledaily.com/dyn/210/images/prod-pics/50605027a0ad4cc4f5254d294a58e6df.jpg,Rp. 99.000,"L'Oreal Paris UV Perfect Matte & Fresh Long UV SPF 50/ PA++++ merupakan tabir surya yang diformulasikan untuk kulit berminyak dengan hasil akhir matte dan terasa ringan pada kulit. Diperkaya dengan Mexoryl dan Long UVA Filters yang membantu mencegah proses penggelapan kulit, noda hitam, dan proses penuaan dini, Oil-Control Formula yang mencegah produksi minyak berlebih, serta Detoxyl yang akan melindungi kulit dari partikel polusi. How to Use:Aplikasikan pada wajah secara merata sebelum beraktivitas di luar ruanganSuitable for:Oily Skin Type & Combination Skin TypeIngredients:-"
sun protection,NIVEA,Sun Protect & White Oil Control Serum SPF 50+,3.9,1605,https://reviews.femaledaily.com/products/moisturizer/sun-protection-1/nivea/sun-protect-and-white-oil-control-serum-spf50-pa,https://image.femaledaily.com/dyn/210/images/prod-pics/product_1598938000_download__800x800.jpg,Rp. 60.000,NIVEA Sun Protect & White Oil Control Serum SPF50 PA+++ merupakan sun face serum yang mengandung oil control formula untuk membuat makeup lebih tahan lama. Mengandung UVA dan UVB filter sebagai perlindungan optimal dari sinar matahari. Memiliki tekstur yang tidak lengket dan nyaman digunakan.How to use:Aplikasikan pada wajah sebelum menjalankan aktivitasSuitable for:Kulit berminyakIngredients:-
sun protection,Carasun,Solar Smart UV Protector SPF45 PA++++,3.7,1444,https://reviews.femaledaily.com/products/moisturizer/sun-protection-1/carasun/carasun-solar-smart-uv-protector-spf45-pa,https://image.femaledaily.com/dyn/210/images/prod-pics/21ad3dcd81f1ddf7c8c49cd35ecf5b47.jpg,Rp. 69.000,Sunscren lokal terbaru dari brand carasun
sun protection,Wardah,UV Shield Airy Smooth Sunscreen Serum SPF 50 PA++++,4.9,1411,https://reviews.femaledaily.com/products/moisturizer/sun-protection-1/wardah/uv-shield-airy-smooth-sunscreen-serum-spf-50-pa-1,https://image.femaledaily.com/dyn/210/images/prod-pics/product_1694750672_UV_Shield__800x800.jpg,Rp. 37.500,"Wardah UV Shield Airy Smooth Sunscreen Serum SPF 50 PA++++ merupakan sunscreen serum yang dilengkapi dengan SkinBoost DNA™ yang efektif melindungi dari 8 penyebab permasalahan kulit sehingga melindungi skin barrier untuk kulit tampak cerah dan halus. Dengan tekstur ringan dan nyaman seringan awan, serta powdery smooth finish.How to use:Aplikasikan merata pada wajah dan leher sebelum beraktivitas. Ulangi pemakaian jika diperlukanSuitable for:Semua jenis kulitIngredients:Aqua, Ethylhexyl Methoxycinnamate, Octocrylene, Butyl Methoxydibenzoylmethane, Polymethyl Methacrylate, Dimethicone, Ethylhexyl Triazone, Ammonium Acryloyldimethyltaurate/VP Copolymer, Phenoxyethanol, Arachidyl Alcohol, Dipropylene Glycol, Butylene Glycol, Behenyl Alcohol, Chlorphenesin, Allantoin, Glycerin, Arachidyl Glucoside, Fragrance, Kaolin, Xanthan Gum, Propanediol, Disodium EDTA, Lecithin, BHT, Trideceth-9, Centella Asiatica Extract, Vitis Vinifera (Grape) Leaf Extract, PEG-40 Hydrogenated Castor Oil, Haberlea Rhodopensis Leaf Extract, Artemisia Capillaris Flower Extract, Ethylhexylglycerin, Polysorbate 20, CI 42090, CI 19140."
sun protection,Skin Aqua,UV Whitening Milk,4.4,1373,https://reviews.femaledaily.com/products/moisturizer/sun-protection-1/skin-aqua/uv-whitening-milk,https://image.femaledaily.com/dyn/210/images/prod-pics/product_1614670648_Untitled_2_800x800.jpg,Rp. 48.000,
sun protection,L'Oreal Paris,UV Defender Bright & Clear,4.6,1341,https://reviews.femaledaily.com/products/moisturizer/sun-protection-1/l-oreal-paris/uv-defender-bright-clear,https://image.femaledaily.com/dyn/210/images/prod-pics/product_1617593583_UVD_Bright_800x800.jpg,Rp. 150.000,"L'Oreal Paris UV Defender Bright & Clear merupakan UV Serum Protector yang dilengkapi dengan Brightening Niacinamide untuk kulit tampak cerah seketika dan terlindugi dari sinar UV. Bright & Clear Serum protector cocok untuk kulit yang tampak kusam dan memerlukan tabir surya dengan efek mencerahkan sektika. How to use:Aplikasikan pada wajah secara merata sebelum beraktivitasSuitable for:Kulit normalIngredients:AQUA / WATER, ETHYLHEXYL METHOXYCINNAMATE, TITANIUM DIOXIDE, SQUALANE, GLYCERIN, DROMETRIZOLE TRISILOXANE, TEREPHTHALYLIDENE DICAMPHOR SULFONIC ACID, PROPYLENE GLYCOL, ALCOHOL DENAT, TRIETHANOLAMINE, DIPROPYLENE GLYCOL, MICA, STEARIC ACID, POTASSIUM CETYL PHOSPHATE, TOCOPHEROL, NYLON 12, CI 77891 / TITANIUM DIOXIDE, NIACINAMIDE, SODIUM COCOYL SARCOSINATE, SODIUM CHLORIDE, PHENOXYETHANOL, DIETHYLAMINO HYDROXYBENZOYL HEXYL BENZOATE, PAEONIA SUFFRUTICOSA ROOT EXTRACT, THERMUS THERMOPHILLUS FERMENT, PEG 100 STEARATE, ETHYLHEXYL TRIAZONE, TRISODIUM ETHYLENEDIAMINE DISUCCINATE, PALMITIC ACID, POLYSORBATE 80, LIMONENE, XANTHAN GUM, LINALOOL, TROMETHAMINE, ISOHEXADECANE, CAPRYLYL GLYCOL, ALPHA ISOMETHYL IONONE, BARIUM SULFATE, CARBOMER, ACRYLAMIDE/SODIUM ACRYLOYLDIMETHYLTAURATE COPOLYMER, MYRISTIC ACID, SORBITAN OLEATE, BIS ETHYLHEXYLOXYPHENOL METHOXYPHENYL TRIAZINE, CETYL ALCOHOL, BUTYLENE GLYCOL, BHT, BUTYROSPERMUM PARKII SEEDCAKE EXTRACT / SHEA SEEDCAKE EXTRACT, POTASSIUM SORBATE, ALUMINUM HYDROXIDE, HEXYL CINNAMAL, GLYCERYL STEARATE, PARFUM / FRAGRANCE"
sun protection,Acnes,UV Tint,3.7,1319,https://reviews.femaledaily.com/products/moisturizer/sun-protection-1/acnes/uv-tint,https://image.femaledaily.com/dyn/210/images/prod-pics/product_1628586107_ee2f95b2ba_800x800.png,Rp. 35.000,"Acnes UV Tint adalah lotion yang dapat melawan bakteri penyebab jerawat, merawat tekstur kulit, serta memiliki kandungan SPF 30 untuk melindungi kulit dari efek buruk sinar UV. Diperkaya dengan kandungan Vitamin B6, Vitamin E, dan turunan Vitamin C sebagai nutrisi yang dibutuhkan kulit serta membuat kulit menjadi lembut. Lotion ini juga dapat menyamarkan noda di kulit. Dapat digunakan sebagai dasar make up yang dapat menyerap minyak.How To Use:Aplikasikan lotion ini ke seluruh wajah secara merata di pagi/siang hari setelah membersihkan wajahSuitable For:Kulit berjerawatIngredients:-"
sun protection,Azarine Cosmetic,Hydramax-C Sunscreen Serum SPF 50 PA++++,4,1267,https://reviews.femaledaily.com/products/moisturizer/sun-protection-1/azarine-cosmetic/hydramax-c-sunscreen-serum-spf-50-pa-blueloght-protection-brightening-1,https://image.femaledaily.com/dyn/210/images/prod-pics/880729403484fb34697f6ec7fb874f2e.jpg,,There's no description for this product.
sun protection,NIVEA,Sun Protect & White Serum Instant Aura SPF 50+,3.9,1162,https://reviews.femaledaily.com/products/moisturizer/sun-protection-1/nivea/nivea-sun-protect-and-white-serum,https://image.femaledaily.com/dyn/210/images/prod-pics/product_1585547055_33656_larg_800x800.jpg,Rp. 52.000,"Double UV protection dg SPF50+ dan PA+++ melindungi kulit wajah dr sinar UVA & UVB yg dapat menyebabkan berbagai kerusakan kulit. Instant Aura : mengandung Aura Booster, Licorice, & Vitamin E membuat kulit terlihat lebih cerah dan berseri. Cocok utk semua jenis kulit."
sun protection,Cosrx,Aloe Soothing Sun Cream,4.1,1004,https://reviews.femaledaily.com/products/moisturizer/sun-protection-1/cosrx/aloe-soothing-sun-cream,https://image.femaledaily.com/dyn/210/images/prod-pics/1469262215_lg.jpg,Rp. 175.000,"Cosrx Aloe Soothing Sun Cream merupakan sun protection yang dapat melindungi kulit dari sinar UVA dan UVB. Diklaim mampu meningkatkan lapisan perlindungan kulit berkat kandungan Aloe Arborescens Extract yang mencapai 5.500 ppm, dilengkapi dengan SPF50+ dan PA +++ ini juga mampu memberikan sensasi soothing saat digunakan, serta membantu menghidrasi kulit dengan baik. How to use:Aplikasikan pada wajah secara merata 30 menit sebelum terpapar sinar matahari.Suitable for:Semua jenis kulitIngredients:Water, Ethylhexyl Methoxycinnamate, Glycerin, Propylene Glycol, Cyclopentasiloxane, Bis-Ethylhexyloxyphenol Methoxyphenyl Triazine, Phenylbenzimidazole Sulfonic Acid, Dicaprylyl Carbonate, Isoamyl P-Methoxycinnamate, Potassium Cetyl Phosphate, Alcohol,Dimethicone, Glyceryl Stearate, Butylene Glycol, Titanium Dioxide, C14-22 Alcohols, Polymethyl Methacrylate, Cetearyl Alcohol, Aloe Arborescens Leaf Extract, Dipotassium Glycyrrhizate, Tocopheryl Acetate, Peg-100 Stearate, Silica, C12-20 Alkyl Glucoside, Dimethicone/Vinyl Dimethicone Crosspolymer, Aluminum Hydroxide, Stearic Acid, Caprylyl Glycol, Acrylates/C10-30 Alkyl Acrylate Crosspolymer, Carbomer, Xanthan Gum, Triethanolamine Sodium Hydroxide, Fragrance, Phenoxyethanol, Disodium Edta"
sun protection,Azarine Cosmetic,Calm My Acne Sunscreen Moisturizer,4,886,https://reviews.femaledaily.com/products/moisturizer/sun-protection-1/azarine-cosmetic/azarine-calm-my-acne-sunscreen-moisturizer-1,https://image.femaledaily.com/dyn/210/images/prod-pics/product_1676268034_sg_1113420_800x800.png,,"Azarine Calm My Acne Sunscreen Moisturizer merupakan tabir surya dalam bentuk gel (water base) yang diformulasi khusus dengan tekstur yang ringan, nyaman, dan tanpa whitecast. Dengan perpaduan kandungan yang mampu merawat, menutrisi sekaligus melindungi skin barrier dari paparan sinar UV A & UV B, bluelight, serta polusi.How to use:Oleskan secukupnya pada wajah sebelum memulai aktivitasSuitable for:Semua jenis kulitIngredients:-"
sun protection,Facetology,Triple Care Sunscreen SPF 40 PA+++,4.6,878,https://reviews.femaledaily.com/products/moisturizer/sun-protection-1/facetology/triple-care-sunscreen-spf-40-pa,https://s3.ap-southeast-1.amazonaws.com/assets.femaledaily.com/remastering-data/production/product/product-1740042771533-f25cbdb2-c121-407e-9bae-82bbba2330be,Rp. 79.900,"Diformulasikan dengan HYBRID formulation dengan menggabungkan kedua macam tipe UV Filters baik physical maupun chemical memberikan perlindungan maksimal terhadap paparan sinar UV Matahari.Facetolgy Triple Care Suncreen tidak hanya memberikan 1 manfaat, namun 3 MANFAAT sekaligus!Hybrid UV Filters dan Blue Oleoactif memberikan perlindungan terhadap UV A, UV B & Blue LightNiacinamide, White Ten TM & Tranexamic Acid mencerahkan wajah CICA, Mugwort & SyriCalm menengankan dan sebagai anti inflamation agentsRasakan NEW ERA OF YOUR DREAM SUNSCREEN Texture Seringan AirSensai dingin sejuk No Drama White Cast Mudah di aplikasikan ga ribet cuman 3O detik!Wajah tampil fresh, ga pake lama siap beraktifitas GRAB YOUR DREAM NOW !"
sun protection,Emina,Sun Battle SPF 30 PA +++,4.1,833,https://reviews.femaledaily.com/products/moisturizer/sun-protection-1/emina/emina-sun-battle-spf-30-pa-1,https://image.femaledaily.com/dyn/210/images/prod-pics/69144aee3961537a675cc9ed659ce8ba.jpg,Rp. 2.500.000,Emina Sun Protection dengan SPF 30 dan PA +++ memiliki tekstur ringan membantu melindungi kulitmu dari sinar UV di hari yang aktif. Diperkaya dengan Aloe Vera extract dan emolient untuk memberikan kelembaban ekstra pada kulit
sun protection,Garnier,Light Complete Super UV Spot Proof Watery Sunscreen,3.9,823,https://reviews.femaledaily.com/products/moisturizer/sun-protection-1/garnier/light-complete-super-uv-spot-proof-watery-sunscreen,https://image.femaledaily.com/dyn/210/images/prod-pics/product_1608175030_LC_Super_U_800x800.jpg,Rp. 65.000,"BARU! Garnier Light Complete Super UV Spot*-Proof Sunscreen. Berikan kulitmu PERLINDUNGAN GANDA dari paparan SINAR UV dan munculnya NODA HITAM*. Formulanya diperkaya dengan : - SPF 50 + : Perlindungan kulit tertinggi dari sinar UVA & UVB untuk lawan penggelapan kulit, timbulnya noda hitam*&kusam- Vitamin C^ : Cerahkan kulit & samarkan noda hitam*- Vitamin E : Lindungi kulit dari sinar matahari dan debu polusiCara Pakai :Oleskan secara merata pada wajah & leher yang sudah dibersihkan. Hindari area mata. Gunakan setiap hari untuk perlindungan dari UV dan base make up mu.Diformulasikan khusus untuk wanita Asia, melindungi kulit agar tidak tampak belang , noda tampak samar, kulit tampak cerah dan tidak meninggalkan noda di pakaian/hijab.Tersedia dalam variant : Natural Finish & Matte FinishCerah & Terlindungi, Bye bye Belang!^Turunan Vitamin C, *noda hitam dari kulit belang karena sinar UV, dengan pemakaian rutin"
sun protection,Skin Aqua,UV Mild Milk,4.1,809,https://reviews.femaledaily.com/products/moisturizer/sun-protection-1/skin-aqua/uv-mild-milk,https://image.femaledaily.com/dyn/210/images/prod-pics/product_1571371590_Untitled_d_800x800.jpg,Rp. 48.000,"Skin Aqua UV Mild Milk melindungki kulit dari sinar UVA dan UVB dengan SPF 25 PA++. Mengandung Improved Hyaluronic Acid, Collagen, dan Vitamin E yang melembabkan, melembutkan, dan mempertahankan elastisitas kulit.How To Use:Usapakan di wajah yang telah dibersihkan. Biarkan hingga meresap dan gunakan make up seperti biasa.Suitable For:Untuk kulit kering dan sensitif.Ingredients:Aqua, Octinoxate, Ethylhexyl Triazone, Cyclomethicone, PEG-60 Hydrogenated Castor Oil, Sodium Hyaluronate, Hydrolyzed collagen, Arginine, Squalane, Polyquaternium-51, Triethylhexanoin, 1,2-Hexanediol, Cetyl Alcohol, Acrylates/C10-30 alkyl acrylate crosspolymer, Xantham Gum, Diethylamino Hydroxybenzoyl Hexyl Benzoate, Phenoxyethanol,TEA, EDTA-2Na, Propylparaben, Methyl Parahydroxybenzoate."
sun protection,Wardah,UV Shield Tone Up Sunscreen,4.2,798,https://reviews.femaledaily.com/products/moisturizer/sun-protection-1/wardah/uv-shield-tone-up-sunscreen,https://s3.ap-southeast-1.amazonaws.com/assets.femaledaily.com/remastering-data/production/product/product-1724148037957-4f7bbb1b-10fd-4be9-b740-7069692d9e31,Rp. 79.000,"Wardah UV Shield Tone Up Sunscreen Serum SPF 50+ PA+++ memberikan perlindungan UV yang kuat dan berfungsi sebagai sunscreen hybrid, menggabungkan manfaat sunscreen, krim tone-up, dan primer dalam satu produk. Produk ini memberikan efek tone-up alami yang secara instan mencerahkan kulit, cocok untuk semua warna kulit. Teksturnya yang lembut dengan tint pink segar secara halus meningkatkan warna kulit alami untuk tampilan yang lebih cerah. How to use:Persiapkan kulit dengan langkah-langkah layering yang tepat: mulai dengan pembersih, lalu toner, serum, dan terakhir pelembap. Pastikan setiap produk diaplikasikan satu per satu dan biarkan setiap lapisan benar-benar terserap sebelum mengaplikasikan sunscreen. Suitable for:Semua jenis kulit. Ingredients:-"
sun protection,Somethinc,Holyshield! UV Watery Sunscreen Gel SPF 50+ PA++++,4,781,https://reviews.femaledaily.com/products/moisturizer/sun-protection-1/somethinc/holyshield-uv-watery-sunscreen-gel-spf-50-pa-3,https://image.femaledaily.com/dyn/210/images/prod-pics/product_1672047072_SOMETHINC_800x800.jpg,Rp. 125.000,"Holyshield! UV Watery Sunscreen Gel SPF 50+ PA++++5-in-1 Cooling Aqua ProtectionSunscreen Gel dengan SPF 50+ PA++++ & teknologi Encapsulated UV Filter yang memberikan proteksi lebih maksimal dari sinar UVA & UVB. Dilengkapi dengan proteksi terhadap Polusi, Blue-Light, & Infra-Red untuk mencegah tanda penuaan dini. Dengan Snowflake Molecules yang memberikan sensasi dingin & menyerap langsung seperti air, nyaman digunakan sepanjang hari, bebas alkohol, tidak lengket, serta no white-cast! Bikin betah & tidak ada alasan lagi untuk tidak pakai sunscreen!Ukuran: 5gr | 15gr | 50grNo BPOM: NA18221700136Jenis Kulit: Semua Jenis Kulit Kelebihan:☀️SPF 50+ PA++++ (semakin banyak tanda plus pada PA, semakin tinggi tingkat proteksi kulit dari UVA)☀️Mengandung Snowflake Molecules yang memberikan sensasi dingin☀️No white-cast, Non-patchy, Non-peeling☀️ Mudah menyerap & tidak lengket☀️Mengandung Organic Sunflower Sprouts & Tara Spinosa yang melindungi kulit dari bahaya sinar blue-light, infrared, & polusi ☀️Tidak membuat kulit kusam ☀️Healthy-glow finish CARA PEMAKAIAN:Aplikasikan sejumlah 2 jari ke seluruh wajah secara merata di tahapan terakhir skincare, sebelum makeup atau 15 menit sebelum terpapar sinar matahariPakai ulang setiap 2 jam sekali untuk mendapatkan perlindungan maksimal."
sun protection,Wardah,UV Shield Aqua Fresh Sunscreen Serum SPF 50 PA++++,3.8,661,https://reviews.femaledaily.com/products/moisturizer/sun-protection-1/wardah/uv-shield-aqua-fresh-essence-spf-50pa-2,https://image.femaledaily.com/dyn/210/images/prod-pics/product_1694766741_example_4_800x800.png,Rp. 59.000,"Wardah UV Shield Aqua Fresh Sunscreen Serum SPF 50 PA++++ merupakan sunscreen serum yang dilengkapi dengan SkinBoost DNA™ yang efektif melindungi dari 8 penyebab permasalahan kulit untuk memelihara kulit supple dan glowing. Dengan tekstur ringan dan nyaman seringan awan, serta glowing finish.How to use:Aplikasikan merata pada wajah dan leher sebelum beraktivitas. Ulangi pemakaian jika diperlukanSuitable for:Semua jenis kulitIngredients:Aqua, Ethylhexyl Methoxycinnamate, Octocrylene, Phenyl Trimethicone, Butyl Methoxydibenzoylmethane, Propanediol, Butyloctyl Salicylate, C14-22 Alcohols, Butylene Glycol, Phenoxyethanol, Allantoin, Nylon-12, C12-20 Alkyl Glucoside, Glycerin, Hydroxyethyl Acrylate/Sodium Acryloyldimethyl Taurate Copolymer, Chlorphenesin, Polysorbate 60, Acrylates/C10-30 Alkyl Acrylate Crosspolymer, Lecithin, Potassium Hydroxide, Fragrance, Squalane, Caprylic/Capric Triglyceride, Dextrin Palmitate, Sorbitan Isostearate, BHT, Deoxyphytantriyl Palmitamide MEA, Artemisia Capillaris Flower Extract, Glucose, Hydrogenated Lecithin, Ceramide NP, Cholesterol, Haberlea Rhodopensis Leaf Extract, 1,2-Hexanediol, Oxygen."
sun protection,Skin Aqua,Tone Up UV Essence SPF50+ PA++++,4.1,652,https://reviews.femaledaily.com/products/moisturizer/sun-protection-1/skin-aqua/tone-up-uv-essence,https://image.femaledaily.com/dyn/210/images/prod-pics/product_1589963145_skinaqua_800x800.jpg,Rp. 150.000,"Skin Aqua Tone Up UV Essence merupakan UV protection dan color control yang mengandung SPF 50+ PA++++ untuk melindungi kulit dari sinar UV-A dan UV-B. Berfungsi sebagai sunscreen sekaligus base make-up, dengan micro coated particle sebagai color control untuk mencerahkan dan meratakan warna kulit wajah.How to use:Aplikasikan secara merata pada wajah sebelum menggunakan make-upSuitable for:Semua jenis kulitIngredients:-"
